posttitle,postlink,postid,numvotes,numcomments,filter,periodfilter
Sad but true,https://www.reddit.com/r/SipsTea/comments/1juefwv/sad_but_true/,1juefwv,67715,1119,top,Past year
The slop I have been eating every day for the last two years.,https://www.reddit.com/r/shittyfoodporn/comments/1otncn2/the_slop_i_have_been_eating_every_day_for_the/,1otncn2,56363,5195,top,Past year
"""He could literally r*pe a child on Fox News, look to the camera and say ""Are you enjoying this America?"" and his cult would still find an excuse for him."" Trumpers in r/TikTokCringe get triggered over a clip of Trump alluding to hiring young women too entrap them",https://www.reddit.com/r/SubredditDrama/comments/1mhu6zu/he_could_literally_rpe_a_child_on_fox_news_look/,1mhu6zu,38104,845,top,Past year
Lost my baby girl of 8 years yesterday,https://www.reddit.com/r/cats/comments/1iu4nj1/lost_my_baby_girl_of_8_years_yesterday/,1iu4nj1,35161,1415,top,Past year
40M living in a subsidised government apartment,https://www.reddit.com/r/malelivingspace/comments/1oykg8l/40m_living_in_a_subsidised_government_apartment/,1oykg8l,35060,2026,top,Past year
"Now do you understand why????""",https://www.reddit.com/r/clevercomebacks/comments/1jmi4sk/now_do_you_understand_why/,1jmi4sk,30250,741,top,Past year
Genie Wiley learning how to talk in 1970. She spent the first 13 years of her life tied to a potty chair in a dark room and being abused by her father. Her love for learning is very evident here. She was ultimately never able to learn a language because of permanant harm to her early development.,https://www.reddit.com/r/Damnthatsinteresting/comments/1jl5bsz/genie_wiley_learning_how_to_talk_in_1970_she/,1jl5bsz,28915,593,top,Past year
Full Circle or Karma? : Trump Edition,https://www.reddit.com/r/facepalm/comments/1orql91/full_circle_or_karma_trump_edition/,1orql91,27844,736,top,Past year
"Recruiter just copied and pasted the job description and didn’t check it, giving a glimpse into the company’s attitude",https://www.reddit.com/r/mildlyinfuriating/comments/1ij1zk8/recruiter_just_copied_and_pasted_the_job/,1ij1zk8,24078,226,top,Past year
"r/Conservative imploding after Donald ""No Wars"" Trump strikes Iran",https://www.reddit.com/r/SubredditDrama/comments/1lhenmr/rconservative_imploding_after_donald_no_wars/,1lhenmr,23904,1960,top,Past year
